{
  "policy_id": "default",
  "policy_version": 1,
  "description": "Conservative default production policy for standalone VFX Forge exports.",
  "defaults": {
    "budget_profile": "Medium",
    "world_units_per_tile": 1.0,
    "max_particles": 5000,
    "max_lights": 4,
    "max_draw_calls": 48,
    "max_layers": 32,
    "max_transparent_layers": 6,
    "max_trail_segments": 24,
    "max_beam_segments": 24,
    "max_duration_sec": 30.0,
    "max_texture_dimension": 1024,
    "max_child_effect_depth": 4
  },
  "contexts": {
    "normal_combat": {
      "budget_profile": "Medium",
      "max_particles": 5000,
      "max_lights": 4,
      "max_draw_calls": 48
    },
    "boss_combat": {
      "budget_profile": "Boss",
      "max_particles": 12000,
      "max_lights": 6,
      "max_draw_calls": 72
    },
    "ground_telegraph": {
      "budget_profile": "Medium",
      "max_particles": 3000,
      "max_lights": 2,
      "max_draw_calls": 24
    },
    "ambient_world": {
      "budget_profile": "Low",
      "max_particles": 1800,
      "max_lights": 2,
      "max_draw_calls": 24
    },
    "cinematic_preview": {
      "budget_profile": "High",
      "max_particles": 14000,
      "max_lights": 8,
      "max_draw_calls": 96
    }
  },
  "allowed_layer_types": [
    "particle", "mesh_particle", "sprite", "light", "trail", "beam", "decal",
    "mesh_effect", "audio_marker", "event_marker", "child_effect"
  ],
  "require_godot_smoke": false
}
